---
title: 📁 Minhas finanças
date: 2025-11-20
created: 2025-11-20T01:02:00-03:00
updated: 2025-11-21T00:15:00-03:00
tags:
  - finanças
  - moc
  - visão-geral
type: moc
---

# Minhas finanças

Visão geral de todas as minhas transações financeiras. Também pode ser visto em [[Minhas finanças.base]].

## Todas as transações

| Data       | Título                                                                                                                                                                                                        | Categoria   | Tipo      | Valor        |
| ---------- | ------------------------------------------------------------------------------------------------------------------------------------------------------------------------------------------------------------- | ----------- | --------- | ------------ |
| 20/12/2023 | [Limpeza dental Arthur Oliveira](2023-12-20%20Limpeza%20dental%20Arthur%20Oliveira.md)                                                                                                                        | Saúde       | gasto     | 180,00       |
| 20/12/2023 | [Transferência mãe](2023-12-20%20Transfer%C3%AAncia%20m%C3%A3e.md)                                                                                                                                            | Família     | receita   | 1.000,00     |
| 01/09/2025 | [Pagamento de Juros de 45.000,00 do Tio Jura - 09-2025](2025-09-01%20Pagamento%20de%20Juros%20de%2045.000,00%20do%20Tio%20Jura%20-%2009-2025.md)                                                              | Renda       | receita   | 1.350,00     |
| 03/10/2025 | [Pagamento de Juros de 45.000,00 do Tio Jura - 10-2025](2025-10-03%20Pagamento%20de%20Juros%20de%2045.000,00%20do%20Tio%20Jura%20-%2010-2025.md)                                                              | Renda       | receita   | 1.350,00     |
| 01/11/2025 | [Pagamento de Juros de 45.000,00 do Tio Jura - 11-2025](2025-11-01%20Pagamento%20de%20Juros%20de%2045.000,00%20do%20Tio%20Jura%20-%2011-2025.md)                                                              | Renda       | receita   | 1.350,00     |
| 04/11/2025 | [Janta de Espetinho no Rubens](2025-11-04%20Janta%20de%20Espetinho%20no%20Rubens.md)                                                                                                                          | Alimentação | gasto     | 54,00        |
| 12/11/2025 | [Pagamento da fatura do Cartão de Crédito Inter - 11-2025](2025-11-12%20Pagamento%20da%20fatura%20do%20Cart%C3%A3o%20de%20Cr%C3%A9dito%20Inter%20-%2011-2025.md)                                              | Boletos     | gasto     | 633,86       |
| 15/11/2025 | [Faixa de Jiu-jitsu nova para Aurora](2025-11-15%20Faixa%20de%20Jiu-jitsu%20nova%20para%20Aurora.md)                                                                                                          | Aurora      | gasto     | 45,00        |
| 16/11/2025 | [Sushi no Zyan](2025-11-16%20Sushi%20no%20Zyan.md)                                                                                                                                                            | Alimentação | gasto     | 194,00       |
| 17/11/2025 | [Compra de comida para café da manhã em panificadora de bairro Pães e Cia](2025-11-17%20Compra%20de%20comida%20para%20caf%C3%A9%20da%20manh%C3%A3%20em%20panificadora%20de%20bairro%20P%C3%A3es%20e%20Cia.md) | Alimentação | gasto     | 10,00        |
| 17/11/2025 | [Pagamento de juros do capital de 10.000,00 emprestados com o Lázaro](2025-11-17%20Pagamento%20de%20juros%20do%20capital%20de%2010.000,00%20emprestados%20com%20o%20L%C3%A1zaro.md)                           | Empréstimos | gasto     | 800,00       |
| 17/11/2025 | [Compras de Lenço umedecido e doces na Americanas](2025-11-17%20Compras%20de%20Len%C3%A7o%20umedecido%20e%20doces%20na%20Americanas.md)                                                                       | Alimentação | gasto     | 43,96        |
| 17/11/2025 | [Dinheiro devido para a mãe enviado a terceiros](2025-11-17%20Dinheiro%20devido%20para%20a%20m%C3%A3e%20enviado%20a%20terceiros.md)                                                                           | Família     | gasto     | 235,00       |
| 18/11/2025 | [Roupa e sapato formatura Aurora](2025-11-18%20Roupa%20e%20sapato%20formatura%20Aurora.md)                                                                                                                    | Aurora      | gasto     | 139,17       |
| 18/11/2025 | [Mensalidade do Jiu-jitsu da Aurora - 11-2025](2025-11-18%20Mensalidade%20do%20Jiu-jitsu%20da%20Aurora%20-%2011-2025.md)                                                                                      | Aurora      | gasto     | 50,00        |
| 18/11/2025 | [Pensão da Aurora - 11-2025](2025-11-18%20Pens%C3%A3o%20da%20Aurora%20-%2011-2025.md)                                                                                                                         | Aurora      | gasto     | 400,00       |
| 20/11/2025 | [Recebimento da primeira parcela do 13º salário - Júpiter Internet](2025-11-20%20Recebimento%20da%20primeira%20parcela%20do%2013%C2%BA%20sal%C3%A1rio%20-%20J%C3%BApiter%20Internet.md)                      | Renda       | receita   | 980,13       |
| 20/11/2025 | [Janta de Pastel no Malagueta Pastel](2025-11-20%20Janta%20de%20Pastel%20no%20Malagueta%20Pastel.md)                                                                                                          | Alimentação | gasto     | 66,00        |
| **Total**  | **Gastos: R$ 2.850,99 · Receitas: R$ 6.030,13**                                                                                                                                                               |             | **Saldo** | **3.179,14** |

## Resumo

- **Total de transações:** 18
- **Gastos:** 13 (R$ 2.850,99)
- **Receitas:** 5 (R$ 6.030,13)
- **Saldo:** R$ 3.179,14

## Categorias principais

- **Renda:** R$ 5.030,13 (13º salário Júpiter, Juros Tio Jura)
- **Família/Empréstimos:** R$ 1.035,00 (Mãe, juros Lázaro)
- **Aurora:** R$ 679,17 (Jiu-jitsu, pensão, formatura, faixa)
- **Boletos:** R$ 633,86 (Fatura cartão Inter)
- **Alimentação:** R$ 367,96 (Pastel Malagueta, Espetinho, Sushi, panificadora, Americanas)
- **Saúde:** R$ 180,00 (Limpeza dental)
